[
  {
    "hypothesis_id": "H-AGD-ALLOMETRY-001",
    "class": "AGD allometry",
    "title": "AGD allometric baseline",
    "claim": "AGD scales with body size across species, sex, and developmental stage.",
    "formal_statement": "AGD ~ body_mass + body_length + sex + age_stage + species",
    "species": ["Homo sapiens", "Mus musculus", "Rattus norvegicus", "Canis familiaris", "Bos taurus"],
    "required_variables": ["AGD_AS", "AGD_AC", "body_mass", "body_length", "species", "sex", "developmental_stage"],
    "correction_factors": ["body size", "sex", "age", "species", "developmental stage"],
    "expected_direction": "positive allometric scaling with body size",
    "primary_test": "log-log allometric regression with sex and age-stage stratification",
    "secondary_tests": ["body-length correction", "quality-grade sensitivity", "species-stratified residual comparison"],
    "eligible_datasets": ["DS-SYNTH-PILOT-001"],
    "replication_threshold": "consistent allometric direction across at least two independent species groups",
    "evidence_grade": "E0",
    "status": "specified",
    "confidence": "low",
    "linked_papers": []
  },
  {
    "hypothesis_id": "H-AGD-FACE-001",
    "class": "AGD-craniofacial",
    "title": "AGD residuals covary with craniofacial residuals",
    "claim": "AGD residuals covary with snout or skull proportion after correcting for body size, sex, species, age, measurement quality, and phylogeny.",
    "formal_statement": "corr(resid(AGD ~ body_size + sex + age + species + phylogeny), resid(face_ratio ~ body_size + sex + age + species + phylogeny)) != 0",
    "species": ["Homo sapiens", "Mus musculus", "Rattus norvegicus", "Canis familiaris", "Bos taurus"],
    "required_variables": ["AGD_AS", "AGD_AC", "body_mass", "skull_length", "snout_length", "sex", "age", "species"],
    "correction_factors": ["body size", "sex", "age", "species", "measurement quality", "phylogeny"],
    "expected_direction": "to be estimated; no directional assumption in v0.1",
    "primary_test": "partial correlation or regression of residualized AGD and craniofacial ratios",
    "secondary_tests": ["Bayesian hierarchical model", "phylogenetic generalized least squares", "bootstrap sensitivity analysis"],
    "eligible_datasets": ["DS-SYNTH-PILOT-001"],
    "replication_threshold": "independent support in at least two datasets or species groups",
    "evidence_grade": "E1",
    "status": "specified",
    "confidence": "low",
    "linked_papers": []
  },
  {
    "hypothesis_id": "H-NEO-FERT-001",
    "class": "neonatal-fertility",
    "title": "Neonatal geometry and later fertility",
    "claim": "Neonatal developmental geometry contributes predictive information about later reproductive outcomes when combined with birthweight, head circumference, gestational age, and puberty timing.",
    "formal_statement": "fertility_outcome ~ neonatal_AGD + birthweight + head_circumference + gestational_age + puberty_timing + confounders",
    "species": ["Homo sapiens", "Mus musculus", "Rattus norvegicus"],
    "required_variables": ["NEONATAL_AGD", "BIRTH_WEIGHT", "HEAD_CIRCUMFERENCE", "GESTATIONAL_AGE", "puberty_timing", "fertility_marker"],
    "correction_factors": ["sex", "gestational age", "birth context", "measurement timing", "ethics tier"],
    "expected_direction": "developmental geometry improves prediction beyond single neonatal measures",
    "primary_test": "nested predictive model comparison",
    "secondary_tests": ["holdout validation", "missingness sensitivity", "aggregate-only human analysis"],
    "eligible_datasets": [],
    "replication_threshold": "longitudinal support in an independent cohort or animal model",
    "evidence_grade": "E0",
    "status": "proposed",
    "confidence": "low",
    "linked_papers": []
  },
  {
    "hypothesis_id": "H-DOMESTICATION-001",
    "class": "domestication",
    "title": "Domestication developmental deformation",
    "claim": "Domesticated or selectively bred lineages show coupled shifts in craniofacial geometry, reproductive timing, stress physiology, and reproductive morphology.",
    "formal_statement": "developmental_coordinates ~ generation + selection_pressure + breed + body_size + sex + age",
    "species": ["Vulpes vulpes", "Canis familiaris", "Felis catus", "Bos taurus", "Sus scrofa", "Capra hircus", "Ovis aries"],
    "required_variables": ["generation", "breed_strain", "selection_pressure", "AGD", "craniofacial_morphology", "litter_size", "fertility_status"],
    "correction_factors": ["body size", "sex", "age", "breed", "inbreeding", "phylogeny"],
    "expected_direction": "selective breeding deforms multiple developmental coordinates together",
    "primary_test": "generation-aware mixed model of reproductive and craniofacial coordinates",
    "secondary_tests": ["inbreeding control", "body-size null model", "lineage sensitivity"],
    "eligible_datasets": [],
    "replication_threshold": "consistent coupled shifts in at least two domesticated or selectively bred systems",
    "evidence_grade": "E0",
    "status": "proposed",
    "confidence": "low",
    "linked_papers": []
  },
  {
    "hypothesis_id": "H-TREATMENT-MANIFOLD-001",
    "class": "treatment response",
    "title": "Fertility treatment response manifold",
    "claim": "Infertility treatment outcomes are better predicted by developmental-state profiles than by conventional fertility markers alone.",
    "formal_statement": "treatment_outcome ~ conventional_markers + developmental_state_coordinates",
    "species": ["Homo sapiens aggregate"],
    "required_variables": ["treatment_type", "age", "fertility_diagnosis", "hormone_values", "gamete_metrics", "embryo_metrics", "implantation", "pregnancy", "live_birth"],
    "correction_factors": ["age", "diagnosis", "treatment type", "clinic/lab", "cycle number", "ethics tier"],
    "expected_direction": "developmental-state coordinates improve predictive performance over conventional baseline models",
    "primary_test": "baseline versus enhanced model comparison using aggregate or controlled-access data",
    "secondary_tests": ["calibration", "holdout validation", "clinic-level random effects"],
    "eligible_datasets": [],
    "replication_threshold": "independent aggregate or controlled-access clinic replication",
    "evidence_grade": "E0",
    "status": "proposed",
    "confidence": "low",
    "linked_papers": []
  }
]

